### ISSUE TITLE
fetching with socks proxy  bad protocol version: 1

### ISSUE THREAD

**Issue by rkanavath** [nicm/fdm#46]
Here is the output of fdm -kvv fetch
```
......
added rule 101: matches=all actions="inbox"
added account "gmail": fetch=pop3s server "pop.googlemail.com" port 995 user "user"
configuration loaded
using proxy: SOCKS5 on proxy.company.fr:1080
locking using: flock
options are: keep-all, maximum-size=20971520, timeout=900, default-user="rkm", command-user="rkm", file-umask=077, queue-high=2, queue-low=1, strip-characters="\<>$%^&*|{}[]"'`;"
using tmp directory: /tmp
parent: started, pid is 64218
parent: 0 children, 0 dead children
parent: child 90799 (gmail) started
gmail: fetch started, pid 90799
gmail: user is 1000
gmail: started processing
gmail: fetching
gmail: fetch loop start
gmail: calling fetch state (0x1955d8410c70, flags 0x02)
gmail: fetch, again
gmail: fetch loop start
gmail: calling fetch state (0x1955d841df10, flags 0x02)
gmail: bad protocol version: 1
gmail: fetch, error
gmail: fetching error. aborted
gmail: 0 messages processed in 0.086 seconds
gmail: finished processing. exiting
gmail: sending exit message to parent
gmail: waiting for exit message from parent
parent: got message type 1, id 0 from child 90799
parent: sending exit message to child 90799
parent: 1 children, 0 dead children
parent: 1 children, 0 dead children
parent: child 90799 socket error
parent: 1 children, 0 dead children
parent: waiting for children
parent: child 90799 returned 1
parent: waiting for children
parent: waiting for children
parent: finished, total time 0.088 seconds
.....
```
Error is triggered from here: https://github.com/nicm/fdm/blob/master/connect.c#L434

**Comment by rkanavath** [comment]
fetching without proxy works fine. I tried to print buf and it is empty before if loop
```
if (buf[0] != 5) {
			xasprintf(cause, "bad protocol version: %d", buf[0]);
			return (-1);
		}
```

**Comment by nicm** [comment]
Can you make a pcap of the exchange with tcpdump?

tcpdump -nli <interface> -wpcap.out host proxy.company.fr and port 1080

Then run fdm, then exit tcpdump and show the pcap.out file.

Change your config to use a dummy user and pass if you have them.

**Comment by rkanavath** [comment]
here is output of tcpdump 
```
tcpdump: listening on em0, link-type EN10MB
12:31:45.691334 172.26.40.201.4238 > 172.26.127.34.1080: S 331393010:331393010(0) win 16384 <mss 1460,nop,nop,sackOK,nop,wscale 6,nop,nop,timestamp 2236877638 0> (DF)
12:31:45.692435 172.26.127.34.1080 > 172.26.40.201.4238: S 1035329108:1035329108(0) ack 331393011 win 5792 <mss 1460,sackOK,timestamp 3386597635 2236877638,nop,wscale
7> (DF)
12:31:45.692461 172.26.40.201.4238 > 172.26.127.34.1080: . ack 1 win 256 <nop,nop,timestamp 2236877638 3386597635> (DF)
12:31:45.692855 172.26.40.201.4238 > 172.26.127.34.1080: P 1:5(4) ack 1 win 256 <nop,nop,timestamp 2236877638 3386597635> (DF)
12:31:45.694415 172.26.127.34.1080 > 172.26.40.201.4238: . ack 5 win 46 <nop,nop,timestamp 3386597635 2236877638> (DF)
12:31:45.694415 172.26.127.34.1080 > 172.26.40.201.4238: P 1:3(2) ack 5 win 46 <nop,nop,timestamp 3386597635 2236877638> (DF)
12:31:45.694477 172.26.40.201.4238 > 172.26.127.34.1080: P 5:25(20) ack 3 win 256 <nop,nop,timestamp 2236877638 3386597635> (DF)
12:31:45.739627 172.26.127.34.1080 > 172.26.40.201.4238: . ack 25 win 46 <nop,nop,timestamp 3386597646 2236877638> (DF)
12:31:45.776419 172.26.127.34.1080 > 172.26.40.201.4238: P 3:5(2) ack 25 win 46 <nop,nop,timestamp 3386597656 2236877638> (DF)
12:31:45.776498 172.26.40.201.4238 > 172.26.127.34.1080: F 25:25(0) ack 5 win 256 <nop,nop,timestamp 2236877638 3386597656> (DF)
12:31:45.777634 172.26.127.34.1080 > 172.26.40.201.4238: F 5:5(0) ack 26 win 46 <nop,nop,timestamp 3386597656 2236877638> (DF)
12:31:45.777660 172.26.40.201.4238 > 172.26.127.34.1080: . ack 6 win 256 <nop,nop,timestamp 2236877638 3386597656> (DF)
```

**Comment by nicm** [comment]
Right but that is useless because it is not a pcap file with the actual packet data.

**Comment by rkanavath** [comment]
pcap is binary file. shall I sent to your gmail?

**Comment by nicm** [comment]
Yes email is fine, or zip it and upload it here, whichever you prefer.

**Comment by nicm** [comment]
Thanks.

The error is from the message after fdm has sent the user and password. The proxy server is sending a message to say "authentication failed" but it has the incorrect version number (it says version 1 not version 5). This is a bug in the proxy server.

It is possible it is also sending the incorrect version number for successful authentications. You can try making fdm not check the version numbers of replies by doing something like this:
~~~~
--- a/connect.c
+++ b/connect.c
@@ -430,7 +430,7 @@ socks5proxy(struct server *srv,
                if (io_wait(io, 2, timeout, cause) != 0)
                        return (-1);
                io_read2(io, buf, 2);
-               if (buf[0] != 5) {
+               if (0 && buf[0] != 5) {
                        xasprintf(cause, "bad protocol version: %d", buf[0]);
                        return (-1);
                }
@@ -462,7 +462,7 @@ socks5proxy(struct server *srv,
        if (io_wait(io, 5, timeout, cause) != 0)
                return (-1);
        io_read2(io, buf, 5);
-       if (buf[0] != 5) {
+       if (0 && buf[0] != 5) {
                xasprintf(cause, "bad protocol version: %d", buf[0]);
                return (-1);
        }
~~~~
But this is a bug in your proxy server and you should report it to them.

**Comment by rkanavath** [comment]
Thanks. I will check with them right away. In the mean time, i will use your patch.

**Comment by nicm** [comment]
Here is a screenshot showing the incorrect version number, but anyone will be able to see it themselves from the pcap file you sent me:
![foo](https://user-images.githubusercontent.com/304243/40358869-a8dafcf2-5db8-11e8-8bd5-0b8f546ac85d.png)

**Comment by rkanavath** [comment]
thanks again. btw which is that viewer?

**Comment by nicm** [comment]
Wireshark.
